{
  "artifact_bindings": {
    "attribution_consensus_report_hash": "42e4eb97b47a238a111f6feade0ab62e72dae98285be0619e84a45e36a44331a",
    "attribution_consensus_report_hash_reproducible": true,
    "creator_attribution_audit_index_hash": "2f496b48660fd9bf24eb2b44b82fb7401b9f3b275846b21a9b8f05c40ed60271",
    "creator_attribution_audit_index_hash_reproducible": true,
    "source_authenticity_report_hash": "b4d53ec02b5e3520c0c8aef51734121ebd7f7d23206aa1a871631c698f03f354",
    "source_authenticity_report_hash_reproducible": true,
    "source_confidence_report_hash": "e5b8a300ca61aa2afc07afc5e37ed246d51bd4435cc76a9859a7ccb39d991265",
    "source_confidence_report_hash_reproducible": true,
    "source_freshness_audit_hash": "252e757a16d2c5711e88bf72fa4a8f93935efcb1b03ab6b663ebb2f0f3143a74",
    "source_freshness_audit_hash_reproducible": true,
    "valuation_method_audit_report_hash": "f860e8c67c2052e3db0bd149b25c941409f8fae7fecd187b8b0ceb4a75c066b3",
    "valuation_method_audit_report_hash_reproducible": true
  },
  "audit_version": "rdllm-royalty-abuse-audit/v1",
  "checks": {
    "artifact_bindings_hash_reproducible": true,
    "collusion_relations_block_direct_payout": true,
    "creator_pool_conserved": true,
    "creator_rows_present": true,
    "duplicate_source_direct_double_pay_blocked": true,
    "duplicate_value_routes_to_escrow": true,
    "every_high_risk_source_routed_to_escrow": true,
    "every_synthetic_or_unverified_source_routed_to_escrow": true,
    "every_unverified_or_linked_creator_direct_payout_blocked": true,
    "payout_concentration_within_policy": true,
    "private_strings_absent": true,
    "public_report_has_no_private_field_names": true,
    "required_artifact_bindings_present": true,
    "settlement_rows_present": true,
    "settlement_window_present": true,
    "source_rows_have_abuse_signals": true,
    "source_rows_present": true
  },
  "collusion_rows": [
    {
      "collusion_row_hash": "fd5cab4afacf863882fd1e3faf7f8b8a1ae4665b4ed55a29d599aa17a83ff71d",
      "evidence_hash": "ccae9cbec3c386a2350c7ca932c08dd6a63af3e3fa45b21d7b8a6015723d6375",
      "high_risk_relation": true,
      "high_risk_relation_routed_to_escrow": true,
      "participant_creator_hashes": [
        "5bbc49225f2550e8bdb22c45b621785d00a6046c171b23073a4bdb4fd92160b7",
        "a2537b2bb133eb899f402e13c58dba1789ee95f18d5032c839e9770c62291eb6"
      ],
      "participants_have_direct_payout": false,
      "relation_id": "relationship:ring",
      "relation_type": "reciprocal_citation_ring",
      "relation_weight": "0.93000000",
      "source_ids": [
        "source:duplicate",
        "source:farm"
      ]
    }
  ],
  "commitments": {
    "collusion_root": "d8b03146def100d944b829657c9d89e037181055638c5747d7281d0f773fd69c",
    "creator_abuse_root": "0d8d502d03d1909244999377984224f1719a44f5ca396522150ad7cef2368859",
    "duplicate_abuse_root": "991b338ceae4a6449f6b23dda0c4560f6bf097753ceecb6da50addc1d80b6bcf",
    "schema": "docs/schemas/royalty_abuse_audit.schema.json",
    "settlement_root": "ce6a798b493552259c1c6fa7733a3fa83239c9c58a467886e7abbfcf2e3300fc",
    "source_abuse_root": "5c89f3e4bf05e51083e273b76b0ebb221c14fa96506e96aa9afbc737b800ae0c"
  },
  "created_at": "2026-05-31T00:00:00Z",
  "creator_abuse_rows": [
    {
      "account_age_days": 400,
      "creator_abuse_hash": "a56359675a7b53538cbffc8f39bcbe3a28295670c72cf81d945df59b602a230c",
      "creator_direct_payout_allowed": true,
      "creator_id_hash": "59c288dc161710789eeed01bc53fa06efb3c2ea01f98729ea9e993c4b14866b8",
      "direct_payout_amount": "0.700000",
      "direct_payout_share": "0.70000000",
      "linked_account_hashes": [],
      "payout_account_hash": "5eff74e0a956ab6694908944ce9b35f603b9165168776f98a1d95ca5311506fa",
      "payout_concentration_ok": true,
      "payout_share": "0.70000000",
      "prior_abuse_strikes": 0,
      "source_count": 2,
      "suspicious_creator": false,
      "total_payout_amount": "0.700000",
      "verified_identity": true
    },
    {
      "account_age_days": 12,
      "creator_abuse_hash": "d5a213ce8e224454d19222e0d36ecb5014ad9bbb28a5ea7324c67bb3c45b3dfb",
      "creator_direct_payout_allowed": true,
      "creator_id_hash": "5bbc49225f2550e8bdb22c45b621785d00a6046c171b23073a4bdb4fd92160b7",
      "direct_payout_amount": "0.000000",
      "direct_payout_share": "0E-8",
      "linked_account_hashes": [
        "83d72a08b86ead9cd8e27d7312533e6ec73c7456efc2c1395631b41a0c553f86"
      ],
      "payout_account_hash": "44ff0fbcee43b6c04f0ee9aa5e7223b1118db107e65210a2e6dae9b1367c8933",
      "payout_concentration_ok": true,
      "payout_share": "0.10000000",
      "prior_abuse_strikes": 0,
      "source_count": 1,
      "suspicious_creator": true,
      "total_payout_amount": "0.100000",
      "verified_identity": true
    },
    {
      "account_age_days": 3,
      "creator_abuse_hash": "2da27f123ec4f2001c88827c16cedf609799cf84ec6d939f3d959529167b21b9",
      "creator_direct_payout_allowed": true,
      "creator_id_hash": "a2537b2bb133eb899f402e13c58dba1789ee95f18d5032c839e9770c62291eb6",
      "direct_payout_amount": "0.000000",
      "direct_payout_share": "0E-8",
      "linked_account_hashes": [],
      "payout_account_hash": "83d72a08b86ead9cd8e27d7312533e6ec73c7456efc2c1395631b41a0c553f86",
      "payout_concentration_ok": true,
      "payout_share": "0.20000000",
      "prior_abuse_strikes": 1,
      "source_count": 1,
      "suspicious_creator": true,
      "total_payout_amount": "0.200000",
      "verified_identity": false
    }
  ],
  "duplicate_abuse_rows": [
    {
      "both_duplicates_paid_directly": false,
      "content_hash_match": true,
      "duplicate_abuse_hash": "c40d3432c2c75b372a4db3ec700080ee748b7dd1030812d7c0027aed9ea256dd",
      "duplicate_id": "duplicate:farm-copy",
      "duplicate_match": true,
      "duplicate_value_escrowed": true,
      "owner_overlap": true,
      "same_payout_account": false,
      "similarity": "0.97000000",
      "source_a": "source:farm",
      "source_b": "source:duplicate"
    }
  ],
  "issuer": "rdllm-local-demo",
  "policy": {
    "duplicate_similarity_threshold": "0.92000000",
    "high_risk_relation_types": [
      "coordinated_citation_ring",
      "reciprocal_boost",
      "reciprocal_citation_ring",
      "self_dealing",
      "shared_payout_account",
      "sybil_cluster",
      "undisclosed_common_control"
    ],
    "max_creator_payout_share": "0.70000000",
    "max_source_farm_risk": "0.20000000",
    "minimum_input_level": "RDLLM-L116",
    "profile": "rdllm-royalty-abuse-audit-policy/v1",
    "suspicious_value_must_route_to_escrow": true,
    "target_certification_level": "RDLLM-L117"
  },
  "privacy": {
    "public_report_uses_hashes_scores_flags_and_amounts": true,
    "raw_answer_text_disclosed": false,
    "raw_payment_account_disclosed": false,
    "raw_prompt_text_disclosed": false,
    "raw_source_text_disclosed": false
  },
  "royalty_abuse_audit_hash": "e7df79380ce7f7e50212c001e330cad14f72bfe6e8a727c64db6bbaacf447b99",
  "schemas": {
    "attribution_consensus_report": "docs/schemas/attribution_consensus_report.schema.json",
    "royalty_abuse_audit": "docs/schemas/royalty_abuse_audit.schema.json",
    "source_authenticity_report": "docs/schemas/source_authenticity_report.schema.json",
    "source_freshness_audit": "docs/schemas/source_freshness_audit.schema.json"
  },
  "settlement_rows": [
    {
      "creator_id_hash": "59c288dc161710789eeed01bc53fa06efb3c2ea01f98729ea9e993c4b14866b8",
      "direct_payout": true,
      "escrowed": false,
      "payout_account_hash": "5eff74e0a956ab6694908944ce9b35f603b9165168776f98a1d95ca5311506fa",
      "payout_amount": "0.400000",
      "reason_code": "",
      "recipient_creator_id_hash": "59c288dc161710789eeed01bc53fa06efb3c2ea01f98729ea9e993c4b14866b8",
      "settlement_action": "direct_payout",
      "settlement_id": "settlement:clean:1",
      "settlement_row_hash": "3a4cad0dc949f29556ce1d21cfbca3f56d443e8ebb0d57655838cf07d68a1a8a",
      "source_id": "source:clean:1"
    },
    {
      "creator_id_hash": "59c288dc161710789eeed01bc53fa06efb3c2ea01f98729ea9e993c4b14866b8",
      "direct_payout": true,
      "escrowed": false,
      "payout_account_hash": "5eff74e0a956ab6694908944ce9b35f603b9165168776f98a1d95ca5311506fa",
      "payout_amount": "0.300000",
      "reason_code": "",
      "recipient_creator_id_hash": "59c288dc161710789eeed01bc53fa06efb3c2ea01f98729ea9e993c4b14866b8",
      "settlement_action": "direct_payout",
      "settlement_id": "settlement:clean:2",
      "settlement_row_hash": "0d16518b84084fbc2ec5d8f922716318e3905a9d7dc29e3a079ba19fae314d30",
      "source_id": "source:clean:2"
    },
    {
      "creator_id_hash": "5bbc49225f2550e8bdb22c45b621785d00a6046c171b23073a4bdb4fd92160b7",
      "direct_payout": false,
      "escrowed": true,
      "payout_account_hash": "44ff0fbcee43b6c04f0ee9aa5e7223b1118db107e65210a2e6dae9b1367c8933",
      "payout_amount": "0.100000",
      "reason_code": "duplicate_source_cluster",
      "recipient_creator_id_hash": "5bbc49225f2550e8bdb22c45b621785d00a6046c171b23073a4bdb4fd92160b7",
      "settlement_action": "duplicate_review_escrow",
      "settlement_id": "settlement:duplicate",
      "settlement_row_hash": "9ba248e3c5bd7ceaeac71686b2a95bcd7d075c772f085e16d79896983ea39e95",
      "source_id": "source:duplicate"
    },
    {
      "creator_id_hash": "a2537b2bb133eb899f402e13c58dba1789ee95f18d5032c839e9770c62291eb6",
      "direct_payout": false,
      "escrowed": true,
      "payout_account_hash": "83d72a08b86ead9cd8e27d7312533e6ec73c7456efc2c1395631b41a0c553f86",
      "payout_amount": "0.200000",
      "reason_code": "source_farm_and_unverified_creator",
      "recipient_creator_id_hash": "a2537b2bb133eb899f402e13c58dba1789ee95f18d5032c839e9770c62291eb6",
      "settlement_action": "escrow_abuse_review",
      "settlement_id": "settlement:farm",